<quiz xmlns:xsi="http://www.w3.org/2001/XMLSchema-instance" xsi:noNamespaceSchemaLocation="quiz.xsd">
	<round>
		<points values="100,200,300,400,500"/>
		<section id="1" name="Anagrams">
			<questions>
				<qa>
					<question><![CDATA[First five books: PEANUT TECH]]></question>
					<answer><![CDATA[PEANUT TECH == PENTATEUCH]]></answer>
				</qa>
				<qa>
					<question><![CDATA[He prophesised the destruction of Nineveh: HUMAN]]></question>
					<answer><![CDATA[HUMAN == NAHUM]]></answer>
				</qa>
				<qa>
					<question><![CDATA[Long live! : HEALTH MUSE]]></question>
					<answer><![CDATA[HEALTH MUSE == METHUSELAH]]></answer>
				</qa>
				<qa>
					<question><![CDATA[This is set on fire by hell: GO TUNE]]></question>
					<answer><![CDATA[GO TUNE == TONGUE (James 3:6)]]></answer>
				</qa>
				<qa>
					<question><![CDATA[Bring out the meaning: SIX GEESE]]></question>
					<answer><![CDATA[SIX GEESE == EXEGESIS]]></answer>
				</qa>
			</questions>
		</section>
		<section id="2" name="Musical Instruments">
			<questions>
				<qa>
					<question><![CDATA[David and the whole house of Israel were singing songs and playing many musical instruments while transporting this.]]></question>
					<answer><![CDATA[The ark of the covenent (II Samuel 6:5)]]></answer>
				</qa>
				<qa>
					<question><![CDATA[In the time of Daniel, people of Babylon had to do this when they heard the sound of many musical instruments.]]></question>
					<answer><![CDATA[bow down and worship the golden image (Daniel 3:5)]]></answer>
				</qa>
				<qa>
					<question><![CDATA[After David had killed the Philistine, the women danced and sang with these instruments]]></question>
					<answer><![CDATA[Tambourines and lutes (triangles) (I Samuel 18:6)]]></answer>
				</qa>
				<qa image="images/kinnor.jpg">
					<question><![CDATA[David's harp had ten strings as shown here. It is commonly known as this]]></question>
					<answer><![CDATA[Kinnor]]></answer>
				</qa>
				<qa>
					<question><![CDATA[This instrument, made of ram's horn was blown during important events,]]></question>
					<answer><![CDATA[Shofar]]></answer>
				</qa>
			</questions>
		</section>
		<section id="3" name="Who said it?">
			<questions>
				<qa>
					<question><![CDATA["But even if He does not, we want you to know, O king, that we will not serve your gods or worship the image of gold you have set up."]]></question>
					<answer><![CDATA[Shadrach, Meshach and Abednego (Daniel 3:18)]]></answer>
				</qa>
				<qa>
					<question><![CDATA["You brood of vipers! Who warned you to flee from the coming wrath?"]]></question>
					<answer><![CDATA[John the baptist (Matt 3:7)]]></answer>
				</qa>
				<qa>
					<question><![CDATA["your sister-in-law is going back to her people and her gods. Go back with her."]]></question>
					<answer><![CDATA[Naomi (Ruth 1:15)]]></answer>
				</qa>
				<qa>
					<question><![CDATA["There is a lion outside!", "I will be murdered in the streets!" ]]></question>
					<answer><![CDATA[The sluggard (Prov 22:13)]]></answer>
				</qa>
				<qa>
					<question><![CDATA["Leave these men alone! Let them go! For if their purpose or activity is of human origin, it will fail. But if it is from God, you will not be able to stop these men;"]]></question>
					<answer><![CDATA[Gamaliel (Acts 5:38,39)]]></answer>
				</qa>
			</questions>
		</section>
		<section id="4" name="Water water everywhere">
			<questions>
				<qa>
					<question><![CDATA[This place is called such because its water was bitter]]></question>
					<answer><![CDATA[Marah (Ex 15:23)]]></answer>
				</qa>
				<qa>
					<question><![CDATA[After this man drank from a God given spring called "En Hakkore", his strength returned.]]></question>
					<answer><![CDATA[Samson (Judges 15:19)]]></answer>
				</qa>
				<qa>
					<question><![CDATA[The Psalmist writes "I tested you at the waters of ___"]]></question>
					<answer><![CDATA[Meribah (Psalm 81:7)]]></answer>
				</qa>
				<qa>
					<question><![CDATA[These men broke through the Philistine lines to get water for David who was very thirsty]]></question>
					<answer><![CDATA[three mighty men (Abishai, Benaiah and unnamed) II Samuel 23:16]]></answer>
				</qa>
				<qa>
					<question><![CDATA[Peter compares false prophets to these. Blackest darkness is reserved for them]]></question>
					<answer><![CDATA[springs without water  (II Peter 2:17)]]></answer>
				</qa>
			</questions>
		</section>
	</round>
	
	<round>
		<points values="100,200,300,400,500"/>
		<section id="1" name="Wine">
			<questions>
				<qa>
					<question><![CDATA[During this 40 year period the Israelites drank no wine]]></question>
					<answer><![CDATA[Wilderness journey ]]></answer>
				</qa>
				<qa>
					<question><![CDATA[This happens to new wine when put in old wineskins]]></question>
					<answer><![CDATA[skins burst (Mark 2:22)]]></answer>
				</qa>
				<qa>
					<question><![CDATA[Lemuel is told in Proverbs that it is not good for people with this occupation to drink wine]]></question>
					<answer><![CDATA[Kings (Proverbs 31:4)]]></answer>
				</qa>
				<qa>
					<question><![CDATA[The king of Susa had been drinking wine when he commanded this woman be brought out]]></question>
					<answer><![CDATA[Queen Vashti (Esther 1:10-11)]]></answer>
				</qa>
				<qa>
					<question><![CDATA[According to Hosea, this Middle East country is famed for its wine.]]></question>
					<answer><![CDATA[Lebanon (Hosea 14:7)]]></answer>
				</qa>
			</questions>
		</section>
		<section id="2" name="Flora">
			<questions>
				<qa>
					<question><![CDATA[The dove returned to Noah's ark with this in its mouth.]]></question>
					<answer><![CDATA[Olive leaf]]></answer>
				</qa>
				<qa>
					<question><![CDATA[This man climbed a tree in order to see Jesus.]]></question>
					<answer><![CDATA[Zacchaeus]]></answer>
				</qa>
				<qa>
					<question><![CDATA[Aaron's rod that budded brought forth this type of fruit]]></question>
					<answer><![CDATA[Almonds (Num 17:8)]]></answer>
				</qa>
				<qa>
					<question><![CDATA[Absalom was fleeing battle when he got his head caught in this type of tree]]></question>
					<answer><![CDATA[Terebinth (oak) (2 Sam 18:9)]]></answer>
				</qa>
				<qa>
					<question><![CDATA[The men who went to spy on Cannon brought grapes, figs and these]]></question>
					<answer><![CDATA[Pomegranates (Num 13:23)]]></answer>
				</qa>
			</questions>
		</section>
		<section id="3" name="Parables">
			<questions>
				<qa>
					<question><![CDATA[The kingdom of heaven is like this seed]]></question>
					<answer><![CDATA[mustard]]></answer>
				</qa>
				<qa>
					<question><![CDATA[The man who built his house upon the sand is compared to this]]></question>
					<answer><![CDATA[he who hears God's words and does not put them into practice]]></answer>
				</qa>
				<qa>
					<question><![CDATA[The kingdom of heaven is like leaven, which a woman took and did this.]]></question>
					<answer><![CDATA[hid in three measures of meal till it was all leavened (Mat 13:33)]]></answer>
				</qa>
				<qa>
					<question><![CDATA[The merchant sold all that he had to acquire this.]]></question>
					<answer><![CDATA[The sluggard (Prov 22:13)]]></answer>
				</qa>
				<qa>
					<question><![CDATA[Jesus told the parable of the unforgiving servant when Peter asked him about this.]]></question>
					<answer><![CDATA[how many times should I forgive my brother? (Matt 18:21)]]></answer>
				</qa>
			</questions>
		</section>
		<section id="4" name="What comes next?">
			<questions>
				<qa>
					<question><![CDATA[Come, let us bow down in worship, let us kneel before the LORD our Maker;]]></question>
					<answer><![CDATA[for he is our God and we are the people of his pasture, the flock under his care... (Ps 95:7)]]></answer>
				</qa>
				<qa>
					<question><![CDATA[Blessed are the meek, for they will inherit the earth.]]></question>
					<answer><![CDATA[Blessed are those who hunger and thirst for righteousness, for they will be filled. (Matt 5:6)]]></answer>
				</qa>
				<qa>
					<question><![CDATA[Though the fig tree does not bud and there are no grapes on the vines,...and no cattle in the stalls, ]]></question>
					<answer><![CDATA[yet I will rejoice in the LORD, I will be joyful in God my Savior. (Habakkuk 3:18)]]></answer>
				</qa>
				<qa>
					<question><![CDATA[The thief comes only to steal and kill and destroy; I have come that they may have life, and have it to the full.]]></question>
					<answer><![CDATA[I am the good shepherd. The good shepherd lays down his life for the sheep (John 10:11)]]></answer>
				</qa>
				<qa>
					<question><![CDATA[No, in all these things we are more than conquerors through him who loved us.]]></question>
					<answer><![CDATA[For I am convinced that neither death nor life, neither angels nor demons, neither the present nor the future, nor any powers, neither height nor depth, nor anything else in all creation, will be able to separate us from the love of God that is in Christ Jesus our Lord.(Rom 8:38-39)]]></answer>
				</qa>
			</questions>
		</section>
	</round>	
</quiz>
